{
  "schema_version": 3,
  "snapshot_date": "2026-08-17",
  "currency": "USD",
  "project_scope": "low-power and unusual hardware candidates for distributed local LLM inference",
  "candidate_categories": [
    "compute_node",
    "mini_pc",
    "dev_board",
    "sbc",
    "embedded_board",
    "specialty_board",
    "control_plane",
    "apple_silicon_system",
    "mobile_phone",
    "tablet",
    "media_device",
    "gpu_accelerator",
    "npu_accelerator",
    "tpu_accelerator",
    "ai_asic_accelerator",
    "fpga_accelerator",
    "adaptive_soc",
    "decommissioned_accelerator",
    "network",
    "memory",
    "storage"
  ],
  "part_files": [
    "catalog/core-nodes.json",
    "catalog/infrastructure.json",
    "catalog/heterogeneous-nodes.json",
    "catalog/benchmarked-reference-nodes.json",
    "catalog/apple-low-power.json",
    "catalog/mobile-devices.json",
    "catalog/gpus.json",
    "catalog/accelerators-genai.json",
    "catalog/accelerators-research.json",
    "catalog/accelerators-specialist.json",
    "catalog/discovery-expansion.json",
    "catalog/auto-promoted.json"
  ]
}
